{
  "resource_id": "places",
  "resource_name": "Platser i Sverige",
  "fields": {
    "name": {
      "type": "string",
      "required": true
    },
    "municipality": {
      "collection": true,
      "type": "integer",
      "required": true
    },
    "larger_place": {
      "type": "integer"
    },
    "population": {
      "type": "integer"
    },
    "area": {
      "type": "integer"
    },
    "density": {
      "type": "integer"
    },
    "code": {
      "type": "integer",
      "required": true
    }
  },
  "sort": "name",
  "id": "code"
}
